title,url,score,comments,created,num_comments
✅ Daily Chat Thread and Discussion ✅,https://www.reddit.com/r/NVDA_Stock/comments/1i9fl4f/daily_chat_thread_and_discussion/,3,1,1737781249.0,1
Meta to Spend as Much as $65 Billion on AI Efforts in 2025,https://www.reddit.com/r/NVDA_Stock/comments/1i8y3b8/meta_to_spend_as_much_as_65_billion_on_ai_efforts/,127,50,1737732838.0,50
Will the adoption of models like DeepSeek's R1 dramatically reduce Nvidia demand?,https://www.nytimes.com/2025/01/23/technology/deepseek-china-ai-chips.html,13,37,1737763227.0,37
Today is my 10 year anniversary of buying NVDA,https://i.redd.it/zvor1chv8qee1.jpeg,13328,509,1737630927.0,509
Nvestigating Nvidia’s world domination,https://youtu.be/4fNSNsyhjmQ?si=TfdG0QgIsRdcsxZU,16,6,1737737537.0,6
